{
  "schema_version": "projection-envelope.v1",
  "object_key": "program.quirk-sync-control-plane",
  "kind": "admission_gauntlet_projection",
  "canonical_uri": "https://github.com/Quirk-Systems/quirk-os/pull/5",
  "canonical_version": "f344af21ff96e9e748a0a0c65dbc20ae71912222",
  "content_hash": "f43a8d9ea62ffe2ccda7ccd47bac798a2f12a78d4081eb12fb02047b5f52fdee",
  "authority_class": "projection",
  "generated_at": "2026-08-12T06:34:11Z",
  "generator_ref": "github://Quirk-Systems/quirk-os/pull/14",
  "projection": {
    "surface": "airtable",
    "base": "admission_gauntlet",
    "candidate_pr": "github://Quirk-Systems/quirk-os/pull/5",
    "candidate_commit": "f344af21ff96e9e748a0a0c65dbc20ae71912222",
    "active_manifests": 0,
    "production_deployments": 0,
    "issue_refs": [
      "github://Quirk-Systems/quirk-os/issues/7",
      "github://Quirk-Systems/quirk-os/issues/8",
      "github://Quirk-Systems/quirk-os/issues/9",
      "github://Quirk-Systems/quirk-os/issues/10",
      "github://Quirk-Systems/quirk-os/issues/11",
      "github://Quirk-Systems/quirk-os/issues/12",
      "github://Quirk-Systems/quirk-os/issues/13"
    ],
    "records_updated": [
      {
        "table": "move",
        "record": "sync-control-plane.execute-admission-gauntlet",
        "status": "Waiting / Make It Real",
        "evidence": "applied_repair_evidence",
        "external_gates": "remaining"
      },
      {
        "table": "agents_and_skills",
        "record": "agent.quirk-sync-steward",
        "status": "Candidate + Passing"
      },
      {
        "table": "agents_and_skills",
        "record": "orchestrator",
        "status": "Candidate + Passing"
      },
      {
        "table": "agents_and_skills",
        "record": "skills_v0.1_unchanged",
        "count": 11,
        "status": "Candidate + Partial",
        "note": "Pending dedicated skill-level evals"
      }
    ],
    "authority_ceiling": "projection_rebuild_and_evidence_updates_only",
    "no_active_manifest_promotion": true,
    "verified_at": "2026-08-12T06:34:11Z",
    "verification_status": "verified"
  },
  "source_bindings": [
    {
      "platform": "github",
      "binding_key": "binding.github.quirk-sync-control-plane.pr5",
      "external_id": "Quirk-Systems/quirk-os#5",
      "external_url": "https://github.com/Quirk-Systems/quirk-os/pull/5",
      "authority_class": "canonical",
      "state": "candidate"
    },
    {
      "platform": "airtable",
      "binding_key": "binding.airtable.admission-gauntlet",
      "external_id": "admission_gauntlet",
      "authority_class": "projection",
      "state": "candidate"
    }
  ]
}
